{
  "task_id": "NRLIS-INFRA-BASELINE-001-R1",
  "status": "partially_supported",
  "conclusion": "The repository has a strong local governance layer and a documented fail-closed collaboration boundary, but it needs repository-enforced CI, pull-request hygiene, sensitive-data scanning, collaboration smoke testing, and main-branch controls before formal iteration.",
  "evidence": [
    {
      "claim": "Content-index integrity is mandatory locally but was not automated in CI.",
      "support": "AGENTS.md requires the audit after changes, and audit_content_index.py compares the filesystem with the authoritative marker block. No supplied file defined a CI gate.",
      "source_path": "AGENTS.md",
      "locator": "Required audit section and scripts/audit_content_index.py main function",
      "evidence_status": "repository_evidence",
      "generalization_level": "none"
    },
    {
      "claim": "The indexed manifest contained no GitHub workflow, pull-request template, security policy, or branch-governance file.",
      "support": "The complete manifest enumerated governance, collaboration, research, literature, and one audit script, but no .github or repository-governance paths.",
      "source_path": "CONTENT_OF_WORK.md",
      "locator": "Complete indexed-file manifest before infrastructure baseline",
      "evidence_status": "repository_evidence",
      "generalization_level": "none"
    },
    {
      "claim": "The collaboration bridge is designed as fail-closed and read-only.",
      "support": "The bridge documentation limits each call to explicit paths in a temporary snapshot, rejects restricted data classes, and forbids treating model agreement as scientific validation.",
      "source_path": "AgentCollaboration/README.md",
      "locator": "Fail-closed diagram, Restricted by default, and Operating rule sections",
      "evidence_status": "repository_evidence",
      "generalization_level": "none"
    },
    {
      "claim": "Collaboration validation existed only as a manual static smoke test.",
      "support": "AgentCollaboration/README.md documented a local smoke-test command, but no supplied repository file ran it as a pull-request gate.",
      "source_path": "AgentCollaboration/README.md",
      "locator": "Validation section",
      "evidence_status": "repository_evidence",
      "generalization_level": "none"
    },
    {
      "claim": "The content-index audit checked path-set equality but did not scan sensitive tracked content.",
      "support": "The script compared actual and indexed paths and excluded private/cache directories from the manifest, but it did not inspect repository files for credentials, sensitive extensions, symlinks, or oversized content.",
      "source_path": "scripts/audit_content_index.py",
      "locator": "is_excluded, actual_files, indexed_files, and main functions",
      "evidence_status": "repository_evidence",
      "generalization_level": "none"
    }
  ],
  "counterarguments": [
    "A single-maintainer private pre-data repository can reasonably begin with lighter controls than a multi-contributor clinical codebase.",
    "Some server-side GitHub settings may exist outside the repository and cannot be inferred from files alone.",
    "Expanding governance checks too broadly can create false failures and process friction."
  ],
  "uncertainties": [
    "The bounded snapshot did not include .gitignore because the bridge rejected that unsupported file type.",
    "GitHub branch protection and rulesets required separate live verification.",
    "The review did not inspect participant-specific, private, raw, authentication, or identifying data."
  ],
  "recommended_checks": [
    "Run the content-index audit on every pull request and push to main.",
    "Add a deterministic repository-safety audit for private paths, secrets, sensitive file types, symlinks, and oversized files.",
    "Run the static AgentCollaboration smoke test in CI without a live model call.",
    "Require a pull-request template with privacy, index, log, and validation attestations.",
    "Use pull-request-only main governance and server-side branch protection when the GitHub plan supports it."
  ],
  "boundary_flags": [
    "Repository infrastructure and governance only.",
    "No participant facts, diagnoses, clinical efficacy, or protocol-science changes.",
    "No web search, subagents, live repository writes, or participant/private paths were available to the review.",
    "Model agreement is review evidence and not scientific validation."
  ],
  "files_examined": [
    "AGENTS.md",
    "AgentCollaboration/README.md",
    "CONTENT_OF_WORK.md",
    "PROJECT_CHANGE_LOG.md",
    "README.md",
    "scripts/audit_content_index.py"
  ]
}
